{
  "id": "kani-basami",
  "name": "Kani-basami",
  "japanese": "蟹挟",
  "style": "Judo",
  "category": "Nage-waza",
  "subCategory": "Yoko-sutemi-waza",
  "description": "Scissors throw, performed by scissoring the opponent's body with the legs (prohibited in competition).",
  "link": "https://en.wikipedia.org/wiki/Kani_basami"
}
