{
  "id": "kuzure-kami-shiho-gatame",
  "name": "Kuzure-kami-shiho-gatame",
  "japanese": "崩上四方固",
  "style": "Judo",
  "category": "Katame-waza",
  "subCategory": "Osaekomi-waza",
  "description": "Modified upper four-quarter hold",
  "link": "https://en.wikipedia.org/wiki/Kuzure_kami_shiho_gatame"
}
